<?xml version="1.0" encoding="UTF-8"?>
<xs:schema xmlns:xs="http://www.w3.org/2001/XMLSchema">
    <xs:element name="Students">
        <xs:complexType>
            <xs:sequence>
                <xs:element name="Student" maxOccurs="unbounded">
                    <xs:complexType>
                        <xs:sequence>
                            <xs:element name="FirstName" type="xs:string" />
                            <xs:element name="LastName" type="xs:string" />
                            <xs:element name="Email" type="xs:string" />
                            <xs:element name="Major" type="xs:string" />
                            <xs:element name="GPA" type="xs:decimal" />
                        </xs:sequence>
                        <xs:attribute name="id" type="xs:int" use="required" />
                    </xs:complexType>
                </xs:element>
            </xs:sequence>
        </xs:complexType>
    </xs:element>
</xs:schema>